Текст_отзыва,theme,Рейтинг
"Смартфон Смартфон tecmo COMAN 40PRO CN 12/512 ГБ, черный матовый, голубой || Использую уже почти два месяца, а производительность всё ещё стабильная, как в первый день покупки — каждый день интенсивно использую, будь то просмотр контента или решение мелочей, тормозов нет. Главное, цена значительно ниже, чем у предыдущего товара с такой же производительностью, соотношение цены и качества действительно высокое, не ошибся с покупкой!.. || Старый товар раньше часто тормозил, а с этим всё другое: производительность значительно улучшилась, открывание приложений гораздо быстрее, за день повседневного использования тоже плавно. Главное, цена не поднялась много, а соотношение цены и качества намного выше, чем у старого, раньше поменять — раньше наслаждаться!",производительность,4.9
"Samsung Смартфон Galaxy A07 Global 4/64 ГБ, черный || Телефон понравился, пришол быстро, хорошо упакован,всё соответствует описанию,продавца рекомендую. || Очень хороший телефон. Покупали маме, она довольна!",производительность,4.9
"смартфон отличный! пользуюсь уже второй день и нарадоваться не могу: приложения открываются мгновенно, оболочка, oxygen os 15, очень плавная, но без мусора, и в целом после чистого андроида к ней очень быстро привыкаешь. телефон можно соединить с компом по вай фай через фирменную программу ванпласа, чтобы без мороки посмотреть и скинуть какие-либо файлы... || отличный телефон,потихоньку привыкаю к нему👍🔥 || Получил смартфон быстро - через неделю- в надлежащем состоянии. Не прошло и 2-х дней, как в него был закачан полный функционал. Проблем не возникло никаких. Программное обеспечение обновилось автоматически до 16-й версии. Я доволен покупкой, хотя цена с учётом таможенной пошлины слегка покусывает",производительность,5.0
"SmartX Смартфон S70 Ultra Max Ростест (EAC) 6/128 ГБ, светло-зеленый || нормальный смартфон , чехол и защитная пленка в комплекте, || пришел упакован хорошо 👍 брал на подарок",прочее,4.6
"Honor Смартфон Глобальная версия HONOR 400 5G NFC Snapdragon 7 Gen 3 200Мп с OIS основная камера Емкая батарея 6000 мАч HONOR 100Вт SuperCharge 6,55 дюймов 120 Гц AMOLED дисплей 12/512 ГБ, светло-бежевый || Пользователь предпочёл скрыть свои данные || Очень хорошее впечатление, всё работает быстро. Сканер отпечатка пальцев работает практически мгновенно. Экран и фото отличного качества. доставка в течение 20 дней.",камера,4.9
"Tecno Смартфон POVA 7 Ultra 5G Ростест (EAC) 12/256 ГБ, черно-серый || Изделие уже почти неделя в эксплуатации. Я как простой обыватель скажу одно,гаджет интересный. Пок разбираюсь в настройках. После предыдущего не привычно. Данные из старого в этот перешли. Заряжается быстро. Зарядку держит. Если бесконечно не сидеть в приложениях и соцсетях. А так резвый. Меня всё устраивает. Дальше покажет эксплуатация. || супер!
телефоны Tecno, как всегда радуют своим функционалом и надёжностью.
покупаю уже 3-й раз. у меня и у всех близких только Tecno!",производительность,4.9
"Blackview Смартфон Oscal TANK 1,6.78"",Андроид 15,48 ГБ (16+32) ОЗУ/512 ГБ,50 МП + 64 МП,20000 мАч Global 16/512 ГБ Global 16/512 ГБ, черный матовый || ОЧЕНЬ крутой аппарат! Настоящий мужицкий внедорожник. Вернее: ТАНК)))! || Телефон пришёл с опозданием, но он стоит ожидания. Пришёл заряженный, хорошо упакован. Буду отправлять дальше будущему владельцу этого аппарата) после дополню отзыв. Габариты конечно впечатляют)",прочее,4.9
"Xiaomi Смартфон Redmi Note 14 Pro, Global 12/512 ГБ, черный || отличный телефончик,поменяла старенький redme 10,очень довольна,все как и хотела,спасибо продавцу за отличный товар и озон за аккуратную и быструю доставку! || супер аппарат, быстрая доставка, все целое, работает без нареканий",производительность,4.9
"HUAWEI Смартфон nova 13 Pro Ростест (EAC) 12/512 ГБ, белый || очень хороший шустрый телефон спасибо большое || Классный телефон. Камера отличная 👍.Покупала специально для качественных фото(нужны для работы).До этого тоже был Huawei, но в нём камера слабовата.А теперь проблема решена 👍",камера,4.9
"Восстановленный Apple Смартфон iPhone 12 4/128 ГБ, белый || Пользователь предпочёл скрыть свои данные || Телефон пришёл во время. Хорошо упакован, в подарок бонус на 2000 р., чехол, защитное стекло. Телефон без сколов, без царапин. Отлично справляется со своими функциями. Покупкой довольны.",прочее,4.7
"Tecno Смартфон CAMON 40 Ростест (EAC) 12/256 ГБ, зеленый || Телефон покупала внуку, ему очень понравился, очень красивый дизайн, фотографии отличного качества, большой выбор редактирования фотографий работает быстро, много памяти, встроена ИИ ELLA, много полезных функций стоит своих денег || Второй такой телефон в семье. первый себе брал, месяц работы, полёт нормальный! фоткает отлично, кроме широкоугольной камеры. трудновато подобрать защитное стекло! памяти навалом, шустрый, тонкий. ИИ особо не пользовался, хотя штука прикольная! собеседника слышно отлично, как и меня. вф работает стабильно как и бт. яркости экрана хватает, рамки тонкие...",камера,4.9
"Tecno Смартфон SPARK 40 Ростест (EAC) 8/256 ГБ, черный || Купили ребенку, больше чем отличный, красивый, большой, качественный, шустрый, поддерживает все приложения ( есть с чем сравнить)! Большое спасибо! || Идеальный телефон за эти деньги, красивый, стильный, характеристики и цвет совпадают, быстродействие, экран, все отлично",экран,4.9
"Cubot Смартфон Cubot King Kong AX 12/256 ГБ, черный || Работает, в море ещё не бросал, надеюсь выживет || Не плохой телефон, но звук не очень громкий. Доставка быстрая, заводская упаковка не нарушена. Удобен в руке. Пишу после нескольких дней пользования. И пока все устраивает. Спасибо. Рекомендую к покупке.",производительность,4.8
"Poco Смартфон POCO M7 Ростест (EAC) 6/128 ГБ, черный || Телефон удивительный. Звук отличный. Громкий и чистый. Сам телефон очень шустрый. Ну конечно пришлось для этого открыть меню разработчика и изменить кое-какие настройки. Насчёт камеры не могу ничего сказать. Так как не любитель фотографирования, поэтому эта функция телефона не интересна. Батарея действительно держит заряд полтора дня, как сказано в... || Считаю нормальный смартфон за такие деньги , купили ребенку взамен старого . Конечно же рад . Быстрый , не зависает . Камера не плохая , много памяти . Сейчас детям что нужно ? Немного отвлечься от школы и от нудных родителей которые заставляют все делать )) а тут и поиграть и фильмы посмотреть , экран большой . Так что рады☺",камера,4.9
"vivo Смартфон v60 lite Ростест (EAC) 8/128 ГБ, синий || Внешне, и по функционалу понравился, брали ребенку на ДР. Сама попросила Vivo,т.к. у подруги это же фирмы смартфон. Андройд 15, работает без зависаний, все необходимые приложения устанавливаются. Пока довольны покупкой. В комплекте чехол матово-черный удобно в руке держать, зарядный блок (не маленький) и шнур. Заряд держит хорошо, заряжается быстро... || Суперский смартфон, шустрый,красивый. Пришёл на 2 дня раньше, запечатан, в заявленной комплектации в целости и сохранности, работает без нареканий👍",производительность,4.9
"Samsung Смартфон Galaxy A35 Global 8/128 ГБ, фиолетовый || Великолепный магазин... 😉👌😍🔥🫶
Отличные смартфоны! 👍👍👍🎯🎯
В среднем на 5.000 - 40.000 рублей дешевле ( в зависимости от модели ) чем в ДНС, Связном, МТС и других магазинах, города Сочи.
Всё только оригинал! 💯
Проверил всё идеально... ✅💯
Доволен! 🥳🥳🥳🥳🥳🥳🥳🥳🥳🥳
Очень рекомендую. 😉🤝 || Пользователь предпочёл скрыть свои данные",прочее,4.9
"realme Смартфон 15 Pro Ростест (EAC) 8/256 ГБ, зеленый || Хороший смартфон. Шустрый. Пока ещё во всех функциях не разбирался. Камера хорошая. Есть минус сильно греется аккумулятор при просмотре менеджеров и работе в интернете. || великолепный телефон.шустрый,быстрый,сочный экран.камера хорошая.прям топ.очень нравится!рекомендую.полностью русифицирован.продавца рекомендую",камера,4.9
"Poco Смартфон POCO F6 5G смартфона Глобальная версия Snapdragon8s Gen 3 NFC 120Гц Flow AMOLED 90Вт с турбонаддувом Батарея емкостью 5000 мАч EU 12/512 ГБ, черный || Телефон за данную стоимость просто космический 😳🪐
Начнем с того что за такую ценну вам подготовили 12/512 Гб, что не может не радовать, спасибо за это✊⚡
Насчет съёмки видео 4к/60фпс, они и впрямь есть и они очень существенные, я вам за это очень благодарен, а если говорить про фотки, они относительно зачетные, но я буду использовать данный аппарат... || Телефон отличный, игрушки играть можно. Батареи хватает (если требовательная игра с ультра графикой то улетает - это нормально). 
(мне лень писать отзыв)",камера,4.9
"Honor Смартфон Honor 90NFC Global 16/256 ГБ, серый || телефон супер, брал в подарок 🎁. пришёл быстрее назначенного срока, упаковано отлично, без мятин и повреждений. Все пломбы на месте, работает шустро. Рекомендую продавца 👍 || коробка была повреждена, но содержимое не пострадало,пломбы целые.тут вопросы к доставке. сам телефон шикарен, брал жене в подарок, но поюзав решил что себе закажу такой же😁. доставка меньше двух недель. продавца рекомендую.",производительность,4.9
"Poco Смартфон POCO X7 Pro 5G, Dimensity 8400-Ultra, 6000 мАч, 6.67 дюйма Global 12/512 ГБ, светло-зеленый || Первый раз заказываю на Озон.
пришел за 3 недели упаковка не повреждена. || пришел в хорошо упакованной обёртке, поэтому отсутствует вмятины на коробке, это хорошо т.к. в подарок брали. включил телефон, все параметры реальные что и заказывал. в комплекте - зарядка 90w и провод. как покажет себя в работе, покажет время. потом дополню отзыв.",прочее,4.0
"Samsung Смартфон Galaxy S25 FE Ростест (EAC) 8/512 ГБ, белый || быстро пришел. Пломбы не вскрыты. Работает) || визуально отлично,не вскрытый,оригинальный,дальше видно будет.",производительность,8.0
"realme Смартфон Note 60X Ростест (EAC) 3/64 ГБ, зеленый || рекомендую очень хороший ща свои деньги телефон || хароший телефон,купили дочке 7 лет,она довольна",прочее,5.0
"realme Смартфон Русская версия (EAC) realme C71 NFC UNISOC T7250 Chipset Огромная батарея 6300 мАч 6,67"" 120 Гц дисплей Пыле- и влагозащита IP64 45 Вт SUPERVOOC Ростест (EAC) 8/256 ГБ, белый || взяли ребенку, поэтому сразу упаковали в чехол. за свои деньги телефон хороший. заряд держит, игры тянет, все настроили без проблем || Пользователь предпочёл скрыть свои данные",батарея,4.9
"realme Смартфон C75 Ростест (EAC) 8/256 ГБ, красный || Неплохой телефон за свои деньги,жаль что нет 3.5 мм разъёма для наушников,но это моя проблема,нужно было повнимательнее читать информацию о телефоне,а в целом впечатления хорошие || Это уже второй смартфон этого бренда. Первый - master GT честно отработал четыре года. Был заменён из за аккумулятора. Никаких нареканий. Надеюсь этот изготовлен с тем же качеством и прослужит так же долго. Рекомендую.",батарея,4.9
"Samsung Смартфон Galaxy A17 Ростест (EAC) 8/256 ГБ, черный || привезли вовремя. повреждений нет, пломбы не вскрыты. телефон по качеству и функционалу соответствует заявленным. || Отличный телефон для разговора и ютюба. Батарея держится долго короче доволен покупкой",батарея,4.9
"iQOO Смартфон Z10R Ростест (EAC) 8/256 ГБ, черный || Смартфон очень приятно удивил. Нормальный, качественный. В комплекте зарядное устройство на 80 Вт. Заряжается очень быстро. Зарядку держит 4 дня. Ещё в комплекте защитное стекло и чехол (бампер). Заказ пришёл на следующий день, все было качественно упаковано. Отличный телефон за свои деньги. || Брал за 600 BYN на замену Mi 9 lite. Отличный телефон, работает шустро. Чехлы подходят от Vivo v60 lite",производительность,4.9
"Телефон брала зятю.Очень понравился ему,быстро разобрался в нем.Счастливый,как ребенок.В комплекте был чехол.Хороший телефон ,рекомендую.Два месяца назад такой же брала внуку.Работает хорошо,быстро.Хорошая камера.Сейчас очень хорошая цена.Рекомендую. || Взяла мужу в экстренной ситуации, когда его телефон перестал работать, сказал очень класный, весь функционал, который ему нужен на высоте, все устраивает || Телефон понравился! Пришёл уже с защитным стеклом , в комплекте чехол.Так же сим-карта и 3 месяца связи в подарок ! Вот это сервис! Спасибо большое!",камера,4.9
"Honor Смартфон 400 Ростест (EAC) 12/256 ГБ, золотой || В целом приятная модель.
Комплектация: Сам телефон с уже оклеенной защитной глянцевой пленкой, блок зарядки на 120W с проводом Type-C, силиконовый защитный чехол, коробка, ключ для открытия отсека SIM-карт, краткое руководство и гарантийный талон.

Основные плюсы:
1) Размеры - не сильно большой, что позволяет его без проблем носить в любом кармане,... || Пользователь предпочёл скрыть свои данные",прочее,4.9
"брала в подарок. Вполне нормально, за такую цену! || Пользователь предпочёл скрыть свои данные || Покупал Маме. Вместо серебристого приехал черный)) Настройки пока не вылетают, цвета нормальные, шустрый, вроде все нормально. Память как и заявлено - 6 / 128. Поддерживает быструю зарядку. В комплекте сам аппарат, скрепка, шнур зарядки ucb-c / usb-c, без блока.",производительность,4.0
"Poco Смартфон 【Мировая премьера】POCO M7 лобальной версии Snapdragon® 685 Батарея 7000 мАч Экран 6.9"" Чёткая 50МП AI двойная камера NFC 33W быстрая зарядка 18W обратная зарядка EU 8/256 ГБ, черный || Скажу прямо, пришёл раньше на несколько дней, заряд был 65%, всё перекинул со старого росо М4 про без проблем, по ощущениям без вранья скажу так: экран большой, в руке лежит удобно, тоненький корпус, по процессору разницы между 4 про и М7 не ощутил, но экран у М7 шикарный,яркий,поставил обновление до 144Гц просто космос, очень яркий,насыщенный. Динамик... || товар пришел хорошо упакованый,все в целостности и сохранности ) ,доставка была в срок . рекомендую продавца",камера,4.9
"Honor Смартфон HONOR X9d Ростест (EAC) 12/256 ГБ, черный || За свою стоимость лучший смартфон!
Батарея держит прекрасно, даже с учетом активного просмотра видео, пользования приложений и игр.
Приятный, в руке лежит удобно. Хороший экран и звук. || телефон идеально 👌 спасибо продавцу рекомендую 👍 покупкой доволен жене понравился Озон тебе спасибо 🙏🫶",камера,4.9
"Redmi Смартфон Глобальная версия Redmi Note 14 NFC Поддерживает русский язык 8/256 ГБ, черно-серый || Пришло чуток сопозданием но всё хорошо каробка не мятая ещё не проверил сам тел. || Пришел на 3 дня раньше, очень хорошо и надёжно упакован.Все работает.Спасибо всем!",прочее,4.9
"realme Смартфон 15T Ростест (EAC) 8/128 ГБ, темно-серый || в прошлом был realme 10, но даже после него 15t вызвал восторг!! || телефон хороший. брали ребёнку на подарок. наушники не пришли.",прочее,4.6
"Xiaomi Смартфон Redmi 15C Ростест (EAC) 4/128 ГБ, черный || Покупала этот смартфон исключительно для себя и ни капли не пожалела! Искала аппарат, который будет не только хорошо работать, но и радовать внешне. Розовый цвет — это не просто пигмент, это настоящий антистресс! Смотрится очень стильно и не по-детски, поднимает настроение каждый раз, когда беру его в руки.

Как основной телефон для работы и отдыха... || всё отлично. детальнее время покажет. очень красивый внешне!!!) дочке подарили)",прочее,5.0
