Текст_отзыва,theme,Рейтинг
"realme Смартфон 14 Pro Ростест (EAC) 8/256 ГБ, белый || Отличный аппарат. Брал в подарок маме, главное было хороший экран, камера пусть и одна, но чтобы была достойного качества ( в данном случае телевик и ширик не нужны особо), батарейка мощная и быстрая система. Так как мама уже 4 года Realme 8 pro пользуется и привыкла к оболочке выбор пал на эту новинку.
Ну что сказать, экран быстрый 120Гц после 60 ощущаются... || телефон супер, описывать характеристики нет смысла, пользуемся телефонами данного бренда уже давно, и всегда только приятные впечатления, новые дизайнерские решения с каждой серией и правда придают индивидуальность телефонам Realme. Брал в подарок супругу на замену Realme 9 pro +. Камера лучше, плавность экрана гораздо лучше. Единственный минус, встречались...",камера,4.9
"HUAWEI Смартфон p30 pro Global 8/512 ГБ, синий || Пользуюсь с 2018 года. Купил такой же. Альтернатива отсутствует до сих пор || Пользователь предпочёл скрыть свои данные",прочее,8.0
"Poco Смартфон POCO F7 Snapdragon® 8s поколения 4 от массивным AMOLED-дисплеем емкостью 6500 мАч диагональю 6,83 дюйма, разрешением 1,5 Кбит/с и частотой 120 Гц EU 12/512 ГБ, белый || телефон пришел быстро упакован хорошо рекомендую. попользуюсь допишу || Отличный смартфон, рекомендую однозначно, шустрый, хорошая камера.",камера,4.0
"Honor Смартфон Magic7 Pro Ростест (EAC) 12/512 ГБ, светло-серый || Общие впечатления от телефона: он очень неплох и во многом будет крайне удобным инструментом как в повседневных делах, так и в рабочих моментах. Но он все же не идеален.

Теперь по порядку.
Что понравилось:
Сочетание железной начинки и операционной системы работает просто идеально. Всё плавно, быстро, без каких-либо задержек. Экран очень яркий — в большинстве... || Доставка: На день раньше чем было заявлен 3 дня, за два дня приехал.
Упаковка обычный пакет озона, коробка телефона не повреждена ни сколько, спасибо за аккуратность. 
Телефон был живой 18 %.
Два дня использования пока все радует, если что отзыв дополню. 
Магазин рекомендую , как и телефон.
От себя замечу, бампер в комплекте симпатичный, но для галочки...",экран,4.9
"iQOO Смартфон Z10R Ростест (EAC) 12/512 ГБ, золотой || телефон пришёл в хорошей упаковке.
открыли в пункте выдачи, всё целое , не разбитое, царапин и вмятин нет. зарядку держит хорошо, качественное фото. ребёнок игр накачал, говорит всё отлично. Не виснет , все видео быстро загружаются. || Брал за 600 BYN на замену Mi 9 lite. Отличный телефон, работает шустро. Чехлы подходят от Vivo v60 lite",камера,4.9
"Poco Смартфон X7 , поддержка русского языка Google Play NFC,глобальная версия Global 12/512 ГБ, салатовый || Пользователь предпочёл скрыть свои данные || Всем приветик))) Нужен был бюджетный и необычный смартфон, такой как не у всех. Пользуюсь Poco F7 уже пару недель — впечатления только положительные! 👍 Смартфон летает — процессор Snapdragon 8s Gen 4 справляется со всем, без зависаний и перегрева. Экран просто шикарный, красочный — 6,83 дюйма, AMOLED, 120 Гц. Отдельно хочу выделить батарею 6500...",батарея,4.9
"realme Смартфон 15T Ростест (EAC) 8/256 ГБ, белый || Телефон хороший, яркость экрана на высоком, телефон работает бытсро || впечатления отличное, работает отлично, заряд держит 2 дня при использовании практически весь день. покупкой довольна . рекомендую",экран,4.6
"Samsung Смартфон Galaxy S25 Ultra Global 12/512 ГБ, черный || товар пришёл быстро, заявленное качество соответствует, покупкой давольна || классный телефон, пришёл раньше, заказывать можно. спасибо продавцу",производительность,4.9
"Tecno Смартфон SPARK 40C Ростест (EAC) 8/256 ГБ, голубой || В руке лежит хорошо, удобно. Пока не пользовались. || Телефон пришел в запаянной упаковке. В комплект вошли: телефон, зарядное устройство, гарантийный талон, инструкция, паспорт, иголочка для симки.
Работает быстро, никаких проблем не обнаружено. Камера вполне достойная, даже панорама. В игры не играю, поэтому ничего сказать не могу.
Общее впечатление для бюджетного телефона - отличное.Продавца рекомендую...",камера,4.9
"Poco Смартфон X7 Pro Ростест (EAC) 12/256 ГБ, зеленый || Пользователь предпочёл скрыть свои данные || Я в полном восторге. Очень понравился дизайн, к тому же он удобный, шустрый, приложения просто летают и обьем памяти 512 для меня то, что надо. До конца еще не все фишки испробовала, но уже с уверенностью могу сказать, что он просто бомба. Берите не пожалеете. Предыдущий был Poco x3 pro, поэтому мой выбор именно Poco. Цвет зелёный, нежный, очень красивый...",прочее,4.9
"realme Смартфон 14T Ростест (EAC) 12/256 ГБ, фиолетовый || Телефон пришел в коробке в заводской упаковке. внутри все, как в описании. Спасибо большое. Все работает || Товар пришёл в цельной упаковке без повреждений. На задней стороне упаковки есть описание на русском языке. Комплектация соответствует описанию, всё целое. Телефон пришёл с заряженной до 25% батареей, что позволило сразу проверить рабочее состояние. Пока нареканий нет, посмотрим как покажет в работе.",батарея,4.9
"Poco Смартфон POCO M7 Pro 5G Taxas includas Плотность 7025-Ультра 120 Гц FHD + AMOLED-дисплей для ухода за глазами Зарядка мощностью 45 ВтTaxas includas Плотность 7025-Ультра 120 Гц FHD + AMOLED-дисплей для ухода за глазами Зарядка мощностью 45 Вт EU 12/512 ГБ, черный || Пользователь предпочёл скрыть свои данные || Отличный смартфон, шел 3 недели. Хорошо упакован, упаковка не вскрывалась. Русифицирован, перенес со старого все программы - летает 👍 Очень доволен покупкой!",экран,4.9
"Poco Смартфон POCO C85 Процессор MediaTek Helio G81-Ultra батарея емкостью 6000 мАч дисплей диагональю 6.9 дюйма быстрая зарядка мощностью 33 Вт Global 8/256 ГБ, зеленый || хорошо работает. шустрый . и не дорого телефон . || Отличный экран: Большой, яркий, с хорошими цветами. Смотреть видео и играть комфортно.
Огромная батарея: Легко хватает на два дня умеренного использования. 
Достаточно шустрый: В повседневных задачах (соцсети, браузер, звонки) не тормозит. Стартовой производительности хватает.
 Минусы:
Камеры посредственные: Днем при хорошем свете снимки еще куда ни...",камера,4.9
"Meizu Смартфон Note 21 Ростест (EAC) 4/256 ГБ, голубой || Всё супер. Рекомендую. Отличный телефон. Буду заказывать ещё такой же ребёнку || Пришёл вовремя,хорошо упаковано. Упаковка заводская. Все работает,характеристики как в описании.Только камера не соответствует заявленным характеристикам.",камера,4.8
"ASUS Смартфон ROG 9 FE , Глобальная прошивка поддерживает русский язык и сервисы Google Global 12/256 ГБ, черно-серый || Хороший аппарат. CN версия (тенцент по старому/привычному). Проблем касательно вида версии никаких нет. Развели миф, что тенцент версия ""косячная"", увы, косячной может оказаться любая версия, кому как повезет. Отличие от остальных версий — нет обновлений по воздуху (OTA) и всё, вручную обновлять очень просто, я бы не сказал, что это минус.
По работе... || Доволен 👍, рекомендую , отличный аппарат !",прочее,4.9
"Honor Смартфон Honor X9C 5G NFC Глобальная версия Snapdragon 6 Gen 1 Емкая батарея 6600 мАч Быстрая зарядка 66Вт 108Мп основная камера 6,78 дюйма 120Гц AMOLED Экран Global 12/256 ГБ, светло-зеленый || телефон пришел хорошо упакован. в заводской плёнке.
доставка была чуть более месяца.
визуально всё хорошо, камера хорошая.
Разбираться с ним буду на днях, дополню отзыв. || Пока что ставлю 5ть звезд.
Доставка из Китая 1 месяц с небольшой задержкой из-за предстоящего праздника НГ.
Брал на распродаже, когда отправили заплатил налог в районе 700р, Общая цена вышла в 19800.
Упаковано в обычный транспортировочный пакет, сам телефон Дополнительно помещен в плотный наполненный воздухом пакет. Упаковка телефона не пострадала,...",камера,4.9
"Apple Смартфон iPhone 16 - SIM+eSIM (новый, не активирован, Face Time работает, eSIM поддерживается) - Global 256 ГБ, зеленый || >Плюсы:
Смартфон действительно ощущается быстрым и шустрым. Новый чип A18 даёт запас мощности: всё работает плавно, нет лагов ни в повседневных задачах, ни в более тяжёлых — играх, монтаже, переключениях между приложениями. 
Камера даёт хорошие фото — особенно при нормальном свете. Основной 48 МП модуль справляется красиво, можно снимать удачные кадры... || Продавцу благодарность. телефон пришел в отличном состоянии, продавец направил для контроля серийный номер,IMEI и т.п. для полного понимания что идёт именно мой телефон и он является оригинальный. По качеству и состоянию вопросов нет. Однозначно советую к приобретению.",камера,5.0
"realme Смартфон 15T Ростест (EAC) 12/256 ГБ, темно-серый || Телефон хороший, яркость экрана на высоком, телефон работает бытсро || впечатления отличное, работает отлично, заряд держит 2 дня при использовании практически весь день. покупкой довольна . рекомендую",экран,4.6
"Samsung Смартфон Galaxy Z Flip7 5G Ростест (EAC) 12/256 ГБ, коралловый || Телефон классный! В принципе была ознакомлена со множеством отзывов и разборами еще до покупки 👀 про эстетическую составляющую: ну не можно, насколько необычный и постоянно хочется открывать/закрывать 😹 поэтому очень довольна, в процессе эксплуатации еще выявлю плюсы и минусы для себя, но пока сплошь удовольствие настраивать под себя темы и приложения... || качественный. удобный. обращайтесь с ним аккуратно и прослужит долго. уже наклонила пленку на внешний экран. немного криво, но на работу это не влияет.

работает отлично.",экран,5.0
"Blackview Смартфон OSCAL PILOT 1,15000мАч, NFC, IPS Экран 6.67’ ,Быстрая зарядка на 33Вт Global 6/256 ГБ, черный матовый || Телефон соответствует описанию , тяжеловат для постоянного использования, для поездок на природу самое то . || Телефон понравился, увесистый, большой экран, хорошее качество изображения",экран,4.9
"Xiaomi Смартфон Redmi 14C Ростест (EAC) 8/256 ГБ, черный || всё работает
брали на подарок
уже в использовании 4 месяца
нареканий нет || брала не себе точно сказать не могу ,но по-моему не жаловались на покупку",прочее,4.9
"Honor Смартфон 400 Ростест (EAC) 12/512 ГБ, черный || В целом приятная модель.
Комплектация: Сам телефон с уже оклеенной защитной глянцевой пленкой, блок зарядки на 120W с проводом Type-C, силиконовый защитный чехол, коробка, ключ для открытия отсека SIM-карт, краткое руководство и гарантийный талон.

Основные плюсы:
1) Размеры - не сильно большой, что позволяет его без проблем носить в любом кармане,... || Пользователь предпочёл скрыть свои данные",прочее,4.9
"HUAWEI Смартфон nova 13 Ростест (EAC) 12/512 ГБ, черный || все как в описании пришел в срок, беру уже третий телефон этой фирмы старый был удобнее нет привычных кнопок возврата и домо || Покупали для ребенка, он очень доволен. Телефон шустрый, с хорошей камерой, на озоне дешевле чем во всех магазинах.",прочее,4.9
"Poco Смартфон poco m7 Global 8/256 ГБ, светло-синий || на первый взгляд хороший аппарат!будем немного посмотреть... || нормальный смартфон,стоит своих денег,аккумулятор мощный 👍,камера средняя,но снимки хорошие при нормальном освещении,чехол положили ,в общем ребёнок доволен.",камера,4.9
"Хороший телефон. Пришел в ценности и сохранности. Единственное, нечувствительный сенсор отпечатка пальца. Я думаю это из-за наклеенной пленки. В целом, понравился. || в комплекте зарядка и бесцветный чехол, к сожалению наушников не было (было заявлено). Телефон заряжен на 90%, сразу всё загрузили. Пока всё отлично. || Телефон пришел нормальный зарядку держит посмотрим что будет дальше",прочее,4.7
"vivo Смартфон x200fe Ростест (EAC) 12/256 ГБ, голубой || Здравствуйте, как пользователь могу добавить некоторые нюансы . 
1. Телефон греется, и греется от обычных действий таких как просмотр контента в тик-токе. Но греется когда от интернета, не от Wi-Fi. В играх не подскажу. В принципе это не критично, но немножко раздражает. 
2. Я думал, что чем тоньше рамки тем лучше, но есть и минусы. Когда выскакивает... || Пользователь предпочёл скрыть свои данные",прочее,4.9
"realme Смартфон Realme GT8 Pro 5G китайская разблокированная версия CN 12/256 ГБ, белый || Очень сбалансированный смарт. Озборщики на GSMArena отмечают, что в GT8 pro Риалми сильно вырос, по сравнению с предыдущими моделями. Хвалят Камеру, динамики, производительность, автономность. Я с ними полностью согласен. Результаты тестов - на видео. 
Русификация очень хорошая и настраивается либо через установку нашей симки до включения и перезагрузкой... || Грушковский Виктор Иванович",камера,4.6
"Samsung Смартфон Galaxy S24 FE Global 8/256 ГБ, темно-серый || телефон отличный. брал на подарок жене, она осталась довольна. по приходу сразу прилетело обновление, установилось всё без каких-либо проблем. обидно что коробка была вскрыта. так понимаю это на таможне. телефон пришел на два дня раньше срока. || Пришел в запечатанном пакете службы доставки, стандартная коробка дополнительно обернута ""пупыркой"". Заводская упаковка вскрыта и заклеена белой пленкой. Заводская пленка с экрана снималась, даже если таможня то ей для чего? И если таможня, то почему упаковка из Дубая до подмосковья доехала не вскрытая? Странно, что не указывается в описании растаможка...",экран,4.9
"отличный смартфон за свои деньги. супер. рекомендую!! || первое впечатление хорошее, дальше посмотрим || четкий телефон. пашет второй месяц. все устраивает",прочее,4.9
"Xiaomi Смартфон REDMI 15 Ростест (EAC) 8/256 ГБ, черный || заказ пришел вовремя в картонной коробке, в комплект входит зарядное устройство, чехол (бортики выше камеры, но сама камера не защищена), перенос информации со старого устройства на новое прошло успешно. сканер отпечатка находится на кнопке включения и выключения устройства, защитная пленка уже есть от производителя, фото получается хорошие четкие,... || Пришло хорошо упакованно, В комплекте: чехол, зарядка. Работает хорошо, потребовал обновить. Всё согласно описанию. Работает быстро. Хоть и заказали после пяти вечера, пришёл на следующий день.",камера,4.9
"VEDYARTI Смартфон I15 Pro Max, В качестве подарка родным и близким Ростест (EAC) 12/512 ГБ, белый || Сначала я купил чехол для мобильного телефона, а затем купил чехол для мобильного телефона.Хотя продавец подарил мне чехол для мобильного телефона, но!Телефон отличный!Обычно трудно купить хороший мобильный телефон по такой цене, но я нашел его. Этот мобильный телефон делает снимки очень четко, процесс использования очень плавный и не заедает, а батарея... || Приехал телефон упакован в плёнку, без доп защиты, коробка чуть помятая. Первое впечатление норм. Посмотрим в работе. Дополню отзыв позже после использования.",батарея,4.9
"Xiaomi Смартфон Redmi 15C 8/256 ГБ, черный, серый || Телефон очень хороший, пришёл раньше срока, всё соответствует описанию, я довольна покупкой. || отличный телефон спасибо всё пришло хорошо упаковано,по работе всё устраивает",прочее,4.9
